{
  "version": 1,
  "toolType": "map",
  "templateId": "map",
  "pageMeta": {
    "title": "红色沙漠地图工具",
    "description": "1988 markers, 44 groups, 9 categories",
    "sourceStatus": "bound-to-datasource"
  },
  "regions": [
    {
      "id": "left-panel.header",
      "components": [
        {
          "id": "game-logo",
          "componentId": "Layout.PictureTitle",
          "props": {
            "logoSrc": "images/logo.png",
            "title": "红色沙漠"
          },
          "dataBinding": {
            "logoSrc": "map.meta.json > game.logo",
            "title": "map.meta.json > game.name"
          }
        }
      ]
    },
    {
      "id": "left-panel.controls",
      "components": [
        {
          "id": "map-select",
          "componentId": "Form.Select",
          "props": {
            "options": [
              {
                "id": "world",
                "label": "世界地图"
              }
            ],
            "value": "world",
            "disabled": true
          },
          "dataBinding": {
            "options": "map.meta.json > maps",
            "value": "renderer selectedMapId"
          }
        },
        {
          "id": "map-search",
          "componentId": "Form.SearchBar",
          "props": {
            "value": "",
            "placeholder": "搜索点位或筛选项"
          },
          "dataBinding": {
            "value": "renderer query state"
          }
        },
        {
          "id": "filter-tree",
          "componentId": "Base.DropdownItem",
          "props": {
            "categoryCount": 9,
            "groupCount": 44
          },
          "dataBinding": {
            "categories": "map.normalized.json > categories",
            "markerCounts": "map.normalized.json > categories[].groups[].count"
          }
        },
        {
          "id": "filter-scrollbar",
          "componentId": "Layout.Scroll",
          "props": {},
          "dataBinding": {
            "scrollTop": "renderer filter list scrollTop",
            "scrollHeight": "renderer filter list scrollHeight",
            "viewportHeight": "renderer filter list viewportHeight"
          }
        }
      ]
    },
    {
      "id": "map.canvas",
      "components": [
        {
          "id": "marker-layer",
          "componentId": "Feedback.Tooltip",
          "props": {
            "markerCount": 1988,
            "visualSize": "constant-during-zoom"
          },
          "dataBinding": {
            "markers": "map.normalized.json > markers",
            "icons": "map.normalized.json > categories[].groups[].icon",
            "coordinates": "map.normalized.json > markers[].position"
          }
        },
        {
          "id": "zoom-in",
          "componentId": "Base.Button",
          "props": {
            "iconOnly": true,
            "action": "zoomIn"
          }
        },
        {
          "id": "zoom-out",
          "componentId": "Base.Button",
          "props": {
            "iconOnly": true,
            "action": "zoomOut"
          }
        }
      ]
    },
    {
      "id": "map.detail",
      "components": [
        {
          "id": "marker-detail",
          "componentId": "Map.PopupDescribeCard",
          "props": {
            "open": false
          },
          "dataBinding": {
            "title": "selected marker > title",
            "description": "selected marker > detail.description | detail.tips | detail.reward",
            "imageSrc": "selected marker > detail.image"
          }
        }
      ]
    },
    {
      "id": "bottom-action",
      "components": [
        {
          "id": "clear-filters",
          "componentId": "Base.Button",
          "props": {
            "action": "resetFilters",
            "label": "取消所有筛选"
          }
        }
      ]
    }
  ],
  "assets": [
    {
      "id": "game-logo",
      "type": "image",
      "source": "images/logo.png"
    },
    {
      "id": "map-package",
      "type": "standard-map-package",
      "source": "."
    },
    {
      "id": "tile-template",
      "type": "tile-template",
      "source": "maps/world/{z}/{x}/{y}.png"
    },
    {
      "id": "icons",
      "type": "asset-base",
      "source": "icons/"
    },
    {
      "id": "detail-images",
      "type": "asset-base",
      "source": "images/"
    }
  ],
  "warnings": [
    "Single map package: map select should be disabled by renderer."
  ]
}
